{
  "schema_version": "loveengine.live-review-transcript/1",
  "run_id": "live-evidence-pilot-001",
  "chain_id": "31337",
  "contracts": {
    "StreamingEngine": "0x5FbDB2315678afecb367f032d93F642f64180aa3",
    "PublicSink": "0xe7f1725E7734CE288F8367e1Bb143E90bb3F0512",
    "CorporateSink": "0x9fE46736679d2D9a65F0992F2272dE9f3c7fa6e0",
    "WitnessDAO": "0xCf7Ed3AccA5a467e9e704C703E8D87F634fB0Fc9",
    "SkillRegistry": "0xDc64a140Aa3E981100a9becA4E685f962f0cF6C9"
  },
  "bootstrap": {
    "schema_version": "loveengine.bootstrap-bundle/2",
    "chain_id": "31337",
    "registry": "0xDc64a140Aa3E981100a9becA4E685f962f0cF6C9",
    "publisher": "0xf39Fd6e51aad88F6F4ce6aB8827279cffFb92266",
    "directory": [
      {
        "schema_version": "loveengine.signed-agent-node-profile/2",
        "chain_id": "31337",
        "registry": "0xDc64a140Aa3E981100a9becA4E685f962f0cF6C9",
        "profile": {
          "node": "0x3C44CdDdB6a900fa2b585dd299e03d12FA4293BC",
          "capabilities": [
            "observe_live_text",
            "review_dispute"
          ],
          "sequence": "1",
          "valid_until": "4102444800"
        },
        "signature": "0x3af1fcb9ca05fb978ca623be9e971f6803a7cf9a21f9086b4f2b3f11f454c8bc3676559f241d5121abdb19adbed190379eb99d89825ef5289ea36548b4ff4ba21b"
      },
      {
        "schema_version": "loveengine.signed-agent-node-profile/2",
        "chain_id": "31337",
        "registry": "0xDc64a140Aa3E981100a9becA4E685f962f0cF6C9",
        "profile": {
          "node": "0x90F79bf6EB2c4f870365E785982E1f101E93b906",
          "capabilities": [
            "observe_live_text",
            "review_dispute"
          ],
          "sequence": "2",
          "valid_until": "4102444800"
        },
        "signature": "0x0f30b6dd2060ea91a473a33b202140b664fdf9475501fefa8e4c551ad2e2aa3b2e0dac0477bc28c1b7a4ace5b38742e76b3cc5ba30a67cee43b3d8ebcc1a332f1b"
      },
      {
        "schema_version": "loveengine.signed-agent-node-profile/2",
        "chain_id": "31337",
        "registry": "0xDc64a140Aa3E981100a9becA4E685f962f0cF6C9",
        "profile": {
          "node": "0x15d34AAf54267DB7D7c367839AAf71A00a2C6A65",
          "capabilities": [
            "observe_live_text",
            "review_dispute"
          ],
          "sequence": "3",
          "valid_until": "4102444800"
        },
        "signature": "0xce31af25a0c16b0d3013caa92386f4cc5086138745e3d2b841ae981d57733cc233a5dfe5993bae91d6c28461d9f246e1ac8598ef8d823c3d020d99ba1b21cb331c"
      }
    ],
    "directory_hash": "0xca19ea185be5826ee769a2107c371669fe7feac118e8f6a7dd65bbd1fcbbcc9e",
    "sequence": "1",
    "valid_until": "4102444800",
    "signature": "0x9f64e77b255325e108c57087db529e73f02ab8bdaa52ce1ad9edc5882780678714ef8ff0797e62025a74fc46e2742237a21077570b5b3174f3546cf0279a00451b"
  },
  "session": {
    "closed_at": "1770000020",
    "created_at": "1770000000",
    "head_event_hash": "0xe50dbd497cd3654b0bb565fe11d224ba0e27db6d185336f7ddb5e07cdfa23f9b",
    "next_sequence": "13",
    "schema_version": "loveengine.live-session/1",
    "session_id": "live-evidence-session-001",
    "source_type": "fixture",
    "status": "closed"
  },
  "events": [
    {
      "schema_version": "loveengine.live-event/1",
      "event_id": "live-001",
      "session_id": "live-evidence-session-001",
      "sequence": "1",
      "occurred_at": "1770000001",
      "category": "source",
      "source_type": "fixture",
      "source_uri": null,
      "content": "Broadcast opened and public observation began.",
      "content_hash": "sha256:dd64565ddaf2a41943d6b08618923f8d5a9635165a2c6d79069a859303b51ab0",
      "artifact_hash": "sha256:dd64565ddaf2a41943d6b08618923f8d5a9635165a2c6d79069a859303b51ab0",
      "media_url": null,
      "media_hash": null,
      "previous_event_hash": "0x0000000000000000000000000000000000000000000000000000000000000000",
      "event_hash": "0x8bf92e3f1acf0a997620a105d38d8da4e054c3d2084a48d956a81899fa5d3c41"
    },
    {
      "schema_version": "loveengine.live-event/1",
      "event_id": "live-002",
      "session_id": "live-evidence-session-001",
      "sequence": "2",
      "occurred_at": "1770000002",
      "category": "source",
      "source_type": "fixture",
      "source_uri": null,
      "content": "Corporate representative described the proposed user count.",
      "content_hash": "sha256:c9e5bf7a0db5f7c69754025d4fa16147d05be01819032bae441c98991da8b608",
      "artifact_hash": "sha256:c9e5bf7a0db5f7c69754025d4fa16147d05be01819032bae441c98991da8b608",
      "media_url": null,
      "media_hash": null,
      "previous_event_hash": "0x8bf92e3f1acf0a997620a105d38d8da4e054c3d2084a48d956a81899fa5d3c41",
      "event_hash": "0x7da6e97611a087ea277d74172a1f439d963c620320943bea955f829ba38050ea"
    },
    {
      "schema_version": "loveengine.live-event/1",
      "event_id": "live-003",
      "session_id": "live-evidence-session-001",
      "sequence": "3",
      "occurred_at": "1770000003",
      "category": "source",
      "source_type": "fixture",
      "source_uri": null,
      "content": "Witness one requested the underlying calculation.",
      "content_hash": "sha256:8970d65e1b713fcb8691716f8dd2d3ede0ec4620c71808fa529650b0d4db72f3",
      "artifact_hash": "sha256:8970d65e1b713fcb8691716f8dd2d3ede0ec4620c71808fa529650b0d4db72f3",
      "media_url": null,
      "media_hash": null,
      "previous_event_hash": "0x7da6e97611a087ea277d74172a1f439d963c620320943bea955f829ba38050ea",
      "event_hash": "0x174839ea909dbfec7520a944555f60d09d60e7294909c0b96e3e3cb000b6761e"
    },
    {
      "schema_version": "loveengine.live-event/1",
      "event_id": "live-004",
      "session_id": "live-evidence-session-001",
      "sequence": "4",
      "occurred_at": "1770000004",
      "category": "source",
      "source_type": "fixture",
      "source_uri": null,
      "content": "Corporate representative supplied a public calculation reference.",
      "content_hash": "sha256:d450c0be0e32169906c7f1a0192aac973d8c7af6c37fca9049907f5e08b82aab",
      "artifact_hash": "sha256:d450c0be0e32169906c7f1a0192aac973d8c7af6c37fca9049907f5e08b82aab",
      "media_url": null,
      "media_hash": null,
      "previous_event_hash": "0x174839ea909dbfec7520a944555f60d09d60e7294909c0b96e3e3cb000b6761e",
      "event_hash": "0xfff7aa61bc8d133638657572758e18f9378111299f3d27c038e54660432115ae"
    },
    {
      "schema_version": "loveengine.live-event/1",
      "event_id": "live-005",
      "session_id": "live-evidence-session-001",
      "sequence": "5",
      "occurred_at": "1770000005",
      "category": "summary",
      "source_type": "fixture",
      "source_uri": null,
      "content": "Summary: the calculation reference was supplied after a witness request.",
      "content_hash": "sha256:0484d9a54dba4d3fb8c7dad1bf1bb1b8c2a71f8024928a87c1a727c8836b0115",
      "artifact_hash": "sha256:0484d9a54dba4d3fb8c7dad1bf1bb1b8c2a71f8024928a87c1a727c8836b0115",
      "media_url": null,
      "media_hash": null,
      "previous_event_hash": "0xfff7aa61bc8d133638657572758e18f9378111299f3d27c038e54660432115ae",
      "event_hash": "0x8703e4a73e296d06a858fd00f82b78e551d4adcd483f870ac7a7d42a0c992a38"
    },
    {
      "schema_version": "loveengine.live-event/1",
      "event_id": "live-006",
      "session_id": "live-evidence-session-001",
      "sequence": "6",
      "occurred_at": "1770000006",
      "category": "source",
      "source_type": "fixture",
      "source_uri": null,
      "content": "Witness two raised a critical completeness dispute.",
      "content_hash": "sha256:3019c977d7d9af5137bc28d1a4d593be3ceaa53b7a076562a0d6f3cf352e7a17",
      "artifact_hash": "sha256:3019c977d7d9af5137bc28d1a4d593be3ceaa53b7a076562a0d6f3cf352e7a17",
      "media_url": null,
      "media_hash": null,
      "previous_event_hash": "0x8703e4a73e296d06a858fd00f82b78e551d4adcd483f870ac7a7d42a0c992a38",
      "event_hash": "0x05574217e8c6ac2f2a2e2daf8e6c6d000f3d641967c95141a1429f2d6949e415"
    },
    {
      "schema_version": "loveengine.live-event/1",
      "event_id": "live-007",
      "session_id": "live-evidence-session-001",
      "sequence": "7",
      "occurred_at": "1770000007",
      "category": "source",
      "source_type": "fixture",
      "source_uri": null,
      "content": "The referenced total was clarified on the public stream.",
      "content_hash": "sha256:5e6d4fdf5fb9e05e1b09d1160fefdc7173da745bfed57858c68e0ae7be33c8aa",
      "artifact_hash": "sha256:5e6d4fdf5fb9e05e1b09d1160fefdc7173da745bfed57858c68e0ae7be33c8aa",
      "media_url": null,
      "media_hash": null,
      "previous_event_hash": "0x05574217e8c6ac2f2a2e2daf8e6c6d000f3d641967c95141a1429f2d6949e415",
      "event_hash": "0xe9cfd64cfa409eee55a30fa120e2bce82253b8792d19117d85809de0cfda73dd"
    },
    {
      "schema_version": "loveengine.live-event/1",
      "event_id": "live-008",
      "session_id": "live-evidence-session-001",
      "sequence": "8",
      "occurred_at": "1770000008",
      "category": "derived",
      "source_type": "fixture",
      "source_uri": null,
      "content": "Derived marker: critical dispute requires three-node review.",
      "content_hash": "sha256:d3a97c3fc2abdc9c6d88ece348103e54e9f4a7df7d5f8d86a7f6346e1f961755",
      "artifact_hash": "sha256:d3a97c3fc2abdc9c6d88ece348103e54e9f4a7df7d5f8d86a7f6346e1f961755",
      "media_url": null,
      "media_hash": null,
      "previous_event_hash": "0xe9cfd64cfa409eee55a30fa120e2bce82253b8792d19117d85809de0cfda73dd",
      "event_hash": "0xf7cff0d0bd68867b3e5535fb23471bd2f6e9202143bcfef84b1b2cb158ddefc3"
    },
    {
      "schema_version": "loveengine.live-event/1",
      "event_id": "live-009",
      "session_id": "live-evidence-session-001",
      "sequence": "9",
      "occurred_at": "1770000009",
      "category": "source",
      "source_type": "fixture",
      "source_uri": null,
      "content": "Witness three confirmed receipt of the clarification.",